Unnamed: 0,meta.movie_name,meta.character_name,meta.gender,text
11257,despicable me 2,GRU,m,"no , no , no ! what do you mean she 's not coming ? ! i have a backyard full of these little who are counting on a visit from a fairy princess ! ah ! hurts ! ah ! stop it ! despicable me 2 cinco & amp ; ken draft 4. listen ! i do n't want a refund ! i want a fairy princess ... please ! please , i am begging you . you know what ? i hope that you can sleep at night , you crusher of little ' dreams ! ! ! any minute now ! stall them . aaaaaahh ! it is i , ... zinkerbell ! the most magical fairy princess of all ! and i am here to wish princess a very happy birthday ! because my house is made of candy and sometimes i eat instead of facing my problems . okay ! time for cake ! you are welcome , little girl . hello , . no , no , no , get off of the limb right now . no limb . no , jill 's , that is not happening . seriously . i 'm fine . no . i 'm sorry . i did not see you there . or there . kyle ... kyle ! ky -- kyle ! no , do not do your business on the petunias ! there you go . those are fred 's . go crazy . good boy . wha ? i did n't ... what ... yes ? oh , sorry , i -- freeze ray ! ugh ... ooh ... what ... where ... ah ... oh , foot 's asleep ... ah ... pins and needles ... ehhh ... okay , this is bogus ! i do n't know who you people think you are , but -- first of all , you 've got no proof that i did that . second , after i did do that , i put it back ! i do n't care . hmm , you usually do n't see that in bunnies . ha ! a mall ? okay , i see where this is going , with all the mission impossible stuff , but no . no ! i am a father now . and a legitimate businessman . i am developing a line of delicious jams and jellies . oh , attitude ! that 's right ! so thanks , but no thanks . and here 's a tip -- instead of tasing people and kidnapping them , maybe you should just give them a call ! good day , mr. sheepsbutt ! oh , yeah , like that 's any better ! hey , i told you guys to get to bed . what ? yeah , well , she is a nutjob . and i 'm not going on any date . hey lisa , i was wondering if you -- scared ? of what ? women ? ! no , that 's bonkers ! i just -- i have no interest in going on a date , that 's all . case closed . i 'm not scared -- of women ... or dates ... let 's go to bed . goodnight , . goodnight , . whoa , whoa , whoa , whoa ! well , hold the horses . who are you texting ? avery ... avery ? is that a girl 's name or a boy 's name ? no , no , it does n't matter ... unless it 's a boy ! uh ... oooh ... you ... do ? oh , yes ... goodnight , . never get older . hey , tim , nice haircut ! donnie , hang in there , baby ! it 's almost friday . so , how 's today 's batch , dr. nefario ? that tastes good ... love the flavor of that ... no ! no ! oh , we 're making great progress ! here , try some of this . whoa ... okay , just because everybody hates it does n't mean it 's not good . what ? what 's wrong ? well , i 'm also considering a line of jams ... dr. nefario ! come on , you 're kidding , right ? very well . let us give you the proper send-off . minions ! the highest honor awarded . to dr. nefario for your years of service . the twenty-one fart gun salute ! good morning , ! i have an announcement to make . ummm ... bruce willis . okay , what are you doing ? oh , okay ... what ? ! no , no , no , no , no , no , no , no , no . no ! stop ! no one is ever getting out there ! ever ! okay , now for the announcement : i have accepted a new job . yes , i have been recruited by a top secret agency to go undercover and save the world ! that 's right , baby ! 's back in the game ! with gadgets and weapons and cool cars ... the whole deal . yes . yes i am . hm . `` bake my day . '' blech . alright , here is the cupcake recipe i got off the internet . and do n't go nuts with the sprinkles ! alright , alright . i got it . i got it ! ... stop it ! okay , that 's weird -- why are you here ? what ? ! no , no `` yay . '' ramsbottom did n't say anything about a partner . yes , he 's one of my minions . ... earth to ! you can leave now . now , what do we got ? who 's on the list ? fire ` em at me . no . not her . i do n't think so . . and this is . and we are closed . look away ! . but it could n't be ... that guy looks exactly like a villain named . from about twenty years ago . he was ruthless . he was dangerous . and as the name implies , very macho . he had a reputation for pulling off heists using only his bare hands . ah , but sadly , like all the greats , was gone too soon . he died in the most macho way possible . riding a shark with 250 pounds of dynamite strapped to his chest into the mouth of an active volcano . it was glorious . they never found the body . oh no . all that was ever retrieved was a pile of singed chest hair . but ... that face . it has got to be . yes , that 's good , because i 'm telling you -- if anybody in this place has the px-41 serum ... ... it 's him . alright , alright , homework done , pajamas on , teeth brushed , time for bed . i just ... i have a lot of work to do . very important business . so ... hugs , kisses ... ... good night , sleep tight , do n't let the bedbugs blah-blah-blah-blah- blah -- fine , fine ... let me hear it . quickly . wow ! that was ... something else . i really liked the way you smiled at the end . let 's try this one more time , but a teensy bit less like a zombie , okay ? perfect ! time to go ! well , what do you mean ? why not ? well , you do n't need one to do the show . i mean , you did the veterans day pageant and you have n't been in combat . okay , well , then ... maybe you can just use your imagination . yes , right . you can do that , ca n't you ? alright , hey , hey -- no , no , no , no ! hey , please ! , jerry , watch the for me , okay ? , -- come this way . with me ! come on ! we 're stealth ninjas . we make no sound . alright , , you 're going down . what ? what are you doing ? it 's a restaurant ! there are no booby traps ! ha ! some guard dog . aaaaaaaaaaaaaaaiiiigh ! get it off of me ! get it off of me ! get it off of me ! i got you ! ugh ... you getting anything ? bah ... ahh ! ooof ! oh , that 's an image i 'll never get out of my brain . blagh ! i knew it ! the serum is in here ! oh , this is going to be good ! ahh ... a-ha ! what ? it 's ... salsa ? we 've been spotted ! come get us ! over here , over here ! over ... here . hold tight ! oh . okay . alright , what do -- oh no . that 's not good . ! what are you doing here ? ha , ha , ha , ha , ha ... funny . , these are my , , and . , . , . hey ! i have an idea ! since and i have lots of work to do , why do n't you go and explore the mall ! here is some money . go buy some useless mall junk ! some headbands , and -- are you out of your gourd ? no ! she just works with me . okay , stop ! that is a song of lies . i do n't even like her ! now go have fun ! ha , ha , ha ! kids ... right ? they 're ... funny . huh . i am pretty fun . all right , i 'm going in . okay ! i get it ! i get it ! you ... know my name ? wow , this looks interesting . what is it ? yeah , not so much . oh , how about this impressive trinket ? yeah , i do n't care . ah ! and what do we have here ? no thanks . so what 's on the other side of the wall ? date ? ? ? boyfriend ? ? ? what ? ? ? oh , no , no , no ! do not say that they are ... no no no , no ! . what is going on here ? me llama-lama-ding-dong , who cares . let 's go . what the -- father ? ! oh ... look at you . haha . he likes me ! well , we really should be going . , come on . no ! you know , they 're not in love . they hardly know each other ! no , no , i am -- yes , but there has been a new development , and i 'm telling you , this is the guy . you need to arrest him immediately . and his deviously charming son . i 'm pretty sure that the son is involved , too . the son also . you 've got to get the son . i think that the son is the mastermind . there 's a look . there 's a devilish look in his eyes and i do n't like it ! evidence schmevidence ! i go with my gut , and my gut tells me that this guy is ! lock him up ! lock up the son . do n't forget about the son . the kid gives me the creeps ! no . i mean , sure , but it 's not him . it is ... ... . no . it is him ! and i will prove it ! , the wi-fi 's out ! ? hey , lance ! where the heck is ? alright , we need to revisit the number of vacation days you guys get . i ca n't find anybody anymore ! ! ! tell i 'm not here ! yes , i hear you . well ... ah . i can tell . we are in a restaurant , you know . ah . well , thank you very much . i was -- hahaha . hoooo . is it hot in here ? oof . how 's the food ? what ? ah ! i do n't think so . oh . what ? no . these locks are all mine ... hello ... hello , are you ... ? hello , , how you doin ' ... ? huh , tell me about it . yeah , you know , as far as dates go , i think i 'm good with just the one . yes . surprisingly , it was . quack ! quack ! quack ! no ! it was horrible ! high-five ! bump it . mr. ramsbottom ? what are you doing here ? got who ? ah . alright . so ... what now ? australia ... ? hey . yay . that 's great . and now you 're going to australia ? great . well ... good luck . your lipstick taser ? oh . thank you , . well ... it looks like they need you , so ... ah , thank you . remember when you said that i liked ? well , it turns out ... you 're right . yes , but ... well , she 's moving away . i 'm never going to see her again . oh , i do n't -- i do n't think so , sweetheart . `` hello , . this is . i know up to this point our relationship has been strictly professional , and you 're leaving for australia and all , but ... '' okay , here is the question . `` would you like to -- to go out on a date ? '' okay , that 's not helping . all right . here we go . for real this time . i can do this . agh ! i hate you ! ah . okay . let 's party . ah ? but first let 's go over the rules . because what is fun without the rules ? , easy on the churros . , try not to kill anyone . -- aghhh ! okay ... there must be the standard six feet of space between you and boys . especially this boy . oh , nothing . nothing is wrong . i 'm just chilling with the guac ... from my chip hat . how did you know ? you ? what the -- huh . oo aaaahhh ... aaaahhh ! oooohhh . aha ! ha ha ha -- ouch ! ha ha ! i knew it ! you are ! nobody believed me ! ho ho ! but i knew you were n't dead ! dr. nefario ? whaaat ? this -- so , this is your new job opportunity ? ? agh ! together ? uh ... yeah ... probably ... despicable me 2 cinco & amp ; ken draft 84. i mean , yes ! yes . of course , yes , i just have a lot going on right now ... i just need to get some things off my plate before we start taking over the world , that 's all . no -- no , forget it ! one hundred percent ! i am in ! i think -- what is -- do you hear that -- i do . that 's calling me from on the surf -- totally in ! ! ! come on ! ooof ! we need to go home now ! where 's ? ! come on , we 're leav -- hey , what 's wrong ? yes ... they stink . sorry , honey , we 've got to go . no , it is not cool . plus , i pretty much knew it was him all along , so if anyone 's cool , it 's me . well , dr. nefario ... ? wha -- that 's impossible ! she 's on her way to australia ... not for long . come on . we 're getting her out of there . hey , guys . come on ! stay focused here ! curses . foiled again . these guys captured me . run ! up that tree ! hurry , hurry ! hey , hey ! nice work , dr. nefario ! thank you , doctor ! now let 's go get the -- you brought the ? you guys take care of the rest of the minions . i 'm going to find . it 's over , . now where is ? no ! lipstick taser ! do n't worry -- i will get you out of this ! i really hate that chicken . listen , -- we may not get out of this alive , so i need to ask you a question . if i 'd asked you out on a date , what would you have said ? ! ! where are you ? ! oh , ! they 'll be back ... "
11335,diner,TANK,m,"you had a payment to make . suppose to have it last night . no one in the office.got a call . you think this is fun and games ? little game that kids play , huh ? 'cause , i 'm not amused . tonight , . no if-ands-or-buts . walks away . slowly straightens up , takes in a few breaths and feels . his stomach . boag.. lucky can . "
11423,"doors, the",HAIRDRESSER,?,"no , i 'm going to worship it . what kind of shampoo are you using ? per yourself sweetheart , you do n't want split ends , you 're a celebrity now . you have very serious-serious hair , it needs to rebel . i 'll give it a tinge of something freaky . scaredy cat . honey , we do n't have enough time . what about you handsome ? all right , be mean ... "
11543,edward scissorhands,GRANDDAUGHTER,f,"why is it snowing , grandma ? where does it come from ? i want to hear . i 'm not sleepy . tell me , please . scissors ? a man ? hands , scissors ? it 's haunted . he did n't have a name ? how do you know ? you could have gone up there . you still could go . how do you know he 's still alive . "
11605,enough,JUPITER'S VOICE,m,"yesterday three men threatened to kill me if i helped you in any way . fortunately for you , this aroused my interest . i 'm sending this via your former boss . if you get it and need more , leave word at my office . what happened to your voice ? ; you okay ? otherwise everything 's okay ? get some rest , huh ? she presses end , says to tova , back to normal voice : "
11689,"fault in our stars, the",DOCTOR,f,"she 's depressed . i may switch you to zoloft . or lexapro . and twice a day instead of once . hmm ? have you been going to that support group i suggested ? 4. if you 're depressed -- -- support groups are a great way to connect with people who are ... on the same journey . just give it a chance , ok ? for me . who knows ? you might even find it ... enlightening . "
11766,flight,GAUNT YOUNG MAN,m,"can i bum a smoke ? i should quit , my cancer might get cancer . joke . you guys in the plane crash ? you 're the fucking pilot . 55. i saw you on tv . holy shit , man . tough deal , but you walked away or it looks like you limped away . home . home for me is the basement , they keep cancer treatment in the basement . i 'm livin ' here . no . i 'm dying here . fibro-mixzoid sarcoma , soft tissue sarcoma . very rare , god chose me . fuck yeah bitch . you 're a stupid fucker if you do n't believe in god . as soon as you realize that the random events in your life are god ... you live a much better life . you spend your life believing that you have all the control over what happens . bullshit . the plane you 're flying goes down ? out of your control . god gives you cancer . i have no control over that . did god give me cancer ? you bet your ass god gave me cancer . you think if i begged for cancer god would have given it to me ? 56. no ... because i assure you i have begged for god to take it away - and guess what ? i have no control over that . can i get another smoke ? what 's wrong with you honey ? you 're beautiful , do you know that ? do i scare you ? people either have to pretend they do n't see me or they 're drawn to me . it 's funny because people see me as being close to the other side -- they feel like i have power or wisdom . they think i have the answers . who knows ? maybe i do . death gives you perspective . i lived my life so indecisive , in a haze . but now that i 'm dying everything is so clear . it all makes sense somehow . i 'm sorry but i ca n't get over how beautiful you are ? look at your arm , you an addict ? what 's your name ? what do you do in the world ? where is it ? i 'll come by , i 'm easy , you can wash my head . do you think you 're gon na die ? 57. you 're not . you 're not gon na die . do n't you love her ? bullshit , i do . random act of god ? do n't think so . survive a plane crash to meet a gorgeous girl in a stairwell . fuck you man . i 'm sure they 're looking for me . my family just showed up from utah . you know it 's bad when they start flying in . every morning is special now , i 'm so grateful . it 's a trip , wish i could bottle this feeling i have ... about how beautiful every breath of life is.. can i get a smoke for the road ? thank you , i 'll pass them out in the cancer ward . take care , you 're gon na be okay . "
11807,forrest gump,OFFICER,m,"p.f.c . gump ? as you were . son , you 've been awarded the medal of honor . sergeant gump ! as you were . i have your discharge papers . your service is up , son . for the army it does . "
12040,the game,BAER,m,"i 'm giving you an overview of our little operation ! you got ta see the new breed of high yield saplings ... how was your flight ? you 've been planning this for months , have n't you ? sandbagging me like this , selling us for scrap ... i was friends with your father , you bastard , i watched you grow up , and now you kick me in the balls -- that 's not how you play the game . you could 've fucking told me ! ca n't find your keys ? up your ass ? i 'm not following you . "
12072,gandhi,POLICE SERGEANT,m,"oh , no , you bloody well do n't ! those passes are government property ! and i will arrest the first man who tries to burn one ! take him away ! now -- are there any more ? ! you little sammy stard -- i -- you want that kind of trouble -- you can have it ! "
12224,"godfather part iii, the",ANOTHER ANGLE,?,"the speech is over and as the audience applauds , the superintendent of the academy crosses an to grundellius . as picks up another picture , this one a framed studio portrait , inscribed , of the secretary . as she locks at it : as the fear comes up . noses into the slip . creak of pilings . the limousine drives onto the ferry . guns have appeared in the hands of the puerto ricans and they start to blast at the limousine from outside . the ferry whistle is blowing . one of the puerto rican kids is hit squarely in the chest . he flies back , azms up , legs sz readea_gi d , like he was hit in the chest with a baseball bat . the services finish and the group breaks into smaller informal , groupings . we move to tom and , who have drifted to one side . anoth.er angle as indicates a moon-faced man , imberto , about sixty , who is approaching them . as rocco lamm pone comes up , clearly agitated : the offers a tempting target . swings . the slaps his cap across 's face , grabs 's wrist and disarms him , throwing him to the ground . rolls to his feet , grabs up the killing knife and presses it to the instrutor 's throat . as comes into the room , palmateer gives him a pen and a couple of pieces of paper . has heard this last . as swings out of bed , naked , crossing out of the bedroom and into the hall . as a. second man appears . this one has a gun . the first man turns to him , speaking in a whisper . as : the second man stands motionless , is on . his feet and up to him . takes the qua from him and tossing it an the bed gestures , forefinger to lips , be quiet . now , turns to the man and . starts down the hall with him . has him by the back of the jacket , his tun pressed against the back of the second man 's head . as bursts bac k into the room , looks , then starts to scream . crosses up and taking her in his arms , softly comforts her . eagen comes around his desk to the door to greet as he enters , followed closely by the cold-looking ralph augusto . as lampone crosses to the window to watch augusto and leave through the pool area below , moves to danny . as grins , shakes hands around and exits , turns to . as the predominantly latin american crowd cheers , we pick out , in civilian clothes , amongst . the ' cheer- ing people . as anjelica turns , her coat swings open slightly and we see that she is dressed in a costume. -- a typical tropicana showgirl kind of thing . as , and- all ` ire at the same time , blowing magudo back down the basement stairs . and the others dive down the stairs . as borracho , pepe and.fararon run into the presidential palace , somebody has started pealing the bells of the cathedral . as e'ararcn cuts the soldier down , then turns to pepe : as pepe and fararon disappear into the darkness follow- ed by , and . pepe runs up , looks in . and the others follow . has broken off as he looks at-fararon . we realize that sometime during the chase the pharoah has taken a bullet in the chest . se 's dying , and pink bubbles of blood fora and break on his lips as he stiizggles for breath . as , pepe and run to the center of the airstrip , looking upward . we can hear the sound of an approaching aircraft . as limousines 4ith soldiers on the ; enders and roofs come inching through the fist-waving , threatening mob . as the gates are opened , soldiers with bayoneted rifles force the crowds back so that the cars can get through , as augusta , danny and the chauffeur move up toward the rear of the truck , the laborer jumps down off the big barrel he 's been sitting on . as the television newscaster switches to another item , we see a burning house , fire engines , so on . as rocco lampcne crosses up to him . as the corleone button men in the following car blasts at the attackers , the shotgun man blasts away . as sits . he 's not sure whether he likes or trusts or is ready to forgive his father , but he knows the sound of good sense when he hears it . takes out a cigar and goes about the ceremony of lighting it . there is a beat . to= and his father look at each other and for a moment we feel that is going to cross to his father , then the moment passes : as goes to his knees , his eyes goggling , the first young man has crosses to the window and opened it . now he and the second young man carry the wide-eyed new york don to the window and throw him out . as 's sailboat drifts in the calm , it 's sails up and motionless , it 's tiller untended . the patrol boat noses up : "
12272,"good girl, the",CUSTOMER,f,"that oneright there . no . excuse me ? oh , i 'm not buying anything today . i did n't bring my purse . wait , you gon na do my hair ? no . i think i look too white , do n't you think ? i think i look kinda wierd . oh . well , you 're the professoinal . do you like it ? "
12390,"green mile, the",FADE TO BLACK,?,"in blackness , a title card appears : "
12402,gremlins,OUTSIDE,?,"the blizzard is starting up . arrives at the broken window . he looks to the ground and sees the creatures are making their way down m in street . they are everywhere . on rooftops . front lawns . smashing through windows . breaking into homes . scattered human screams echo through the night . people are dying . mogwai is taking over the . town ' . runs to below 's window . he shouts to her . the rows of once peaceful , cheerful homes are now the scenes of frenzied horror . people run out into the night , screaming for help , only to be dragged to the ground by creatures . ravaged bodies lie in the snow . frozen . an ambulance is overturned on the roadside . phone lines are town down . the creatures have made their way across town . they now attack the last few houseson the block . the headlights shine on 's overturned police car . is . still alive . he screams for help . he closes the door . is safe . walks to the.sheriff 's car . he stays in the safety of the headlight 's beam . stops a few feet from the sheriff 's car . the passenger side is crushed . the driver 's side is barely damaged , save for a dented , jammed door . pounds against-the door . he wants out . grabs the car handle . he pulls hard . the door pops open . he pulls out . gets to his feet . he 's okay . looks the car . closes the door . a blanket of snow . covers everything . it snowed hard last night.. three feet 's worth . the creatures arrive at the top of the hill . they move to the greenhouse doors the sun is coming up . the darkness fades . and stand in the snow.. they look out over kingston falls . now a ghost town . looks at his sword . he pull back , nd throws the sword . it flip throw h the air . { snow . collapses in the snow . exhausted . kneels beside him. -- it close-up the tool box shakes and rattles in the worker 's hand . frightened , he throws the box-over a hilly , wooded area at the side of the road . "
12501,"hangover, the",OFFICER MERRIWEATHER,m,"where were you last night at 3am ? you think this is cute , son ? ! you think this is a game ? ! what do you know about ? runs the infamous shiang- xi crime organization , and is wanted in seven states for money laundering , drug smuggling , racketeering and murder . is that right ? you actually expect me to believe that dung ? if i find out you 're lying to me , son , i will take all of you down , is that clear ? if you know what 's good for you , you 'll get the hell out of vegas . "
