Unnamed: 0,meta.movie_name,meta.character_name,meta.gender,text
13,1492: conquest of paradise,SAILOR,f,"we left three weeks ago, alonso. can't be that near. we'll all go crazy... ah, leave him alone.  he's doing no harm. the water's going putrid in the barrels."
48,15 minutes,ROBERT HAWKINS,m,"but doesn't the son of sam law prevent criminals from profiting from their crimes? and isn't there a movie in the works about you? permanently disrupted?  aren't you selling paintings now for quite a lot of money?  hasn't this 'incident' as you call it, jump started your career as an artist? you seem very savvy for a man who's been found mentally incompetent to stand trial. ...so you feel absolutely no responsibility for killing these people? your doctor?"
59,2001: a space odyssey,MILLER,m,"i suppose you saw the work on our new section while you were docking. well, shall we go through documentation? well.. did you have a pleaant flight? well, thank you very much for being so understanding. i'm terribly sorry. i was just on my way down to meet you. i saw your ship dock and i knew i had plenty of time, and i was on my way out of the office when, suddenly, the phone rang."
106,8mm,DIRECTOR,m,"it's good what you're doing. it's horrible, but it'll be your best friend after a few days.  i hope you realize what kind of long shot you're chasing after. files are mostly by state and year of disappearance.  we try to keep the children and adults separate. no eating or smoking in here, but there's a coffee machine in the hall. well, that's all i can do.  sorry. i can give you my card, if your clients want to call me... i'm not so sure about this. why don't they come to me? we do. why not go to the n.c.i.c. or n.c.m.e.c.? there are reasons for the way we do things here. alright, tom. what can i do for you, mr. welles?"
138,the atomic submarine,SAUCER VOICE,?,"obviously. of course.  but it is time to be- gin the return voyage -- it is a living thing.  when damaged - you would say 'wounded' - it immediately 'heals' itself. i have selected you, to return with me - along with several other specimens, for study.  we will examine you and the others, discover desirable features to incorporate in our 'earth-colonizers.' on the contrary.  i want you - unharmed - perfect. i am afraid not.  therefore - your friend was to remain where he was! my mission is to study various solar systems, and planets - select the most suitable for colonization - point of view is everything. to us, <u>your</u> form of life is ugly as we appear to you. remove your weapons, commander. and come here - alone!"
312,american outlaws,TELLER,m,"all right, all right.  jesse james never yelled at folk... where is jesse james? of course!  uh, sir?"
455,barry lyndon,ARMED GENTLEMAN,m,"is your mother not afraid on account of the highwayman to let one so young as you travel? where are you bound for? good day to you, young sir."
547,blast from the past,MISS SWEET,f,"sure. your mom was a dancer? you're kidding! we work on rodeo drive.  but we're both professional dancers. he's really funny! this is my new friend... bravo! oh, now, that's a great one! yes?"
578,blue velvet,MRS. WILLIAMS,f,"i'll get a coat for her. nice of you to offer, jeffrey, but certainly not. just relax and enjoy your coffee. i'm sure sandy will be back soon. please excuse me a moment, jeffrey, and i'll get to the dishes. anyone else? alright jeffrey, just a minute. here you are. would anyone like coffee? oh, you're welcome. nice to finally meet you, jeffrey. he comes over to study. it's a real good chocolate cake. duncan hines' devil's food. real good. would you like a piece of cake? i was sorry to hear about your father. i know your mother from church. it's such a shame. really, he'll be home soon, would you like a cup of coffee? oh, yes, jeffrey. come in. he'll be back any minute now. you're welcome to wait. is it urgent?"
580,blue velvet,MR. BEAUMONT,m,"hey jeff. i'm feelin' so much better. good to see you, son. uh-uh. uh-uh. hey jeff."
611,bottle rocket,MAN,m,"no, it's not. come on in! how's the weather down there? no. me no hoto. tecate? you hoto? fight. you know. si. tecate. you like to fight? she is a good looking woman. where's your friend? he go with the chiquita? you a good pool player. you like chicanos? she chicano, yes? is that your chiquita? hello, my friend. you in the army, yes?"
629,braveheart,LEADER,m,then we'll just have a peek at the wounds.  dig 'em up! what it means in england -- and in scotland too -- is that rebels have forfeited their lands. we were ambushed last night. but the scots dragged their dead away. someone dead from this household?
643,the butterfly effect,MRS. BOSWELL,f,"when i asked evan about his drawing, well, he didn't remember doing it. of course. there is one more thing, mrs. treborn. and i feel bad for mentioning it... yesterday i had all the children draw pictures of what they wanted to be when they grew up. most of them made drawings of what their parents did, but this... i was going to show this to the principal, but i wanted to talk to you first. mrs. treborn! i need to speak with you!"
699,the cider house rules,FUZZY,f,"what's an immigrant? did you grow up around here? what's a nanny do? did you know your mother better? but did you know him? *liver* killed him? is *your* father dead? why can't we have pumpkins for christmas, too? we don't get any good presents at christmas, anyway. is that soon? his father's dead, right? that's why kong loves her! homer... doesn't king kong think the woman is his *mother*?"
827,the elephant man,BOY,m,"like this. our man is sick. come right away. i found it. excuse me, mr. treves, sir. don't! what are you going to do? he's sick, bytes. he's going to die. aw, bytes, he's sick."
843,erik the viking,FREYA,?,"that i cannot tell you. the gods are asleep, erik. the sky was blue, erik... once. but have you ever seen it? think back... have you ever seen the sun, erik? is it summer or winter, erik? is it night or day, erik? what do you see, erik? they will make fun of you for listening to an old woman's stories? now what can you want with me, erik the ""viking""?"
857,erik the viking,THORFINN'S MUM,f,"and if you have to kill somebody, kill them! don't stop to think about it. and keep your sword greased. and don't forget: never let your enemy get behind you. and something to sharpen them with? and you've got both axes?"
1164,gladiator,GRACCHUS,m,you're a citizen and a soldier.  not a gladiator. would you support the senate if they would give you a trial?  you'd have to give me your word. how did you get condemned to the arena without a trial? who are you?  narcissus the good?  i have heard of narcissus meridas. that's who i hear you are.
1269,harold and maude,MRS. CHASEN,f,"i think i should mention, candy, that harold does have his eccentric moments. yes, that's good planning. tell me, are you a regular, candy, in this computer club? eh, poli sci? and what are you studying? you are at the university, candy? how do you do. i'm mrs. chasen. come in. she supplies the whole southwest with chicken feed. yes. henderson feed and grain. edith was just telling me about her job. oh. well, what is it exactly that you do? how interesting. and what do you do, my dear? edith, i'd like you to meet my son, harold. harold, this is edith... eh? this way, edith. harold is out by the garage. he has a new car and he has been tuning it up. he's very mechanical. this is insane. harold! you don't care! ""miss shroud of 1890 weds the boy of a thousand deaths!"" listen to me... oh... that's wonderful... i get an eighty-year-old pallbearer for a daughter-in-law! be reasonable, harold! you're dealing with your life! what will people say?! love? love? what do you <u>know</u> about her? where does she come from? where did you meet her? a sunflower? i suppose you think this is very funny, harold. to whom? fay, i'll call you back.  what did you say? harold, please! i'm on the phone. not now, harold...  you can't put me down for monday? well, i want you to go to bed directly after dinner. you know how susceptible you are to colds. harold has always been a delicate child. even as a baby he seemed to be abnormally prone to illness - harold, dear, eat up your beets... of course, harold's father had a similar sense of the absurd. i remember once in paris he stepped out for cigarettes and the next i hear he's arrested for floating nude down the seine - experimenting in river currents with a pair of yellow rubber water wings. well, that cost quite a little bit of ""enfluence"" and ""d'argent"" to hush up, i can tell you. harold, dear, stop playing with your food. don't you feel well?"
1420,the hustler,YOUNG MAN,m,"yeah, i'm quittin'. you better not miss, friend. heads. okay, friend. you're on. you sure you don't want to quit, friend? okay. try me. you wanna raise the bet? two on the five, five on the nine? i guess it's just you and me, huh? how much are you ahead? you quittin' too? okay, friend. a dollar on the five, two on the nine. hi."
1443,independence day,SECOND OFFICER,m,"it's... slowing down, sir. well, er... it's slowing down. no sir. definitely not."
1479,innerspace,WOMAN,f,i didn't say anything. you did. joe no i didn't. you said   something first. i said...i didn't say..anything! nothing. nothing. what's what?
1481,innerspace,RECEPTIONIST.,f,"water fountain's through that door, down the hall. is there anything else? ...mr. athol will be with you as soon as possible. will you be able to wait? i'm sorry. we're running behind. so many applicants...so few jobs... if you'll just have a seat."
1547,it happened one night,ELLIE'S VOICE,f,"i'm hungry. what time is it? yes? oh, by the waywhat's your name? oh, excuse me."
1573,jfk,GARRISON,m,"i can't believe you're saying this in the courtroom. that's our case! jesus, ed, from time immemorial it's been standard booking procedure to ask an alias.  you know that.  there's no constitutional requirement that says a lawyer has to be present for routine questions. what?"
1622,jacob's ladder,WOMAN,f,"if you're lucky. tan? what tan? it faded on the airplane. i'd try to get my money back, but who do you ask?  two hundred dollars a night, for what? hot. where do i sign? that's what i'd like to know. if you see him on the street somewhere, tell him he's fired. i know. that's why i'm asking. how 'bout over there?  no wait. do me a favor. bring 'em to the back room. i no from around here."
1731,lon,MAN,m,"don't fear. ...one second. ...yes? huh? move back, baby, i can't see anything. huh! you made an error, baby.  i don't know any danielle. yes?"
1744,labor of love,FATHER,m,"you don't have to prove anything to her. doubts?  about what? that's a reasonable assumption. most certainly. why? i see. from where? to where? i asked the officers if you had committed some crime... if they had said 'yes', you would be speaking with them right now. if i had seen you.  by the way i'm sorry about your wife.  they told me."
1807,the life of david gale,ABERNATHY,f,"better make it a week. that's my girl. no, nigger. they ain't men, mae rose. they're convicts. and nigger convicts to boot. can you say nigger? it's a boy! well, let's get a look at him. and the baby? is mae rose okay?"
1828,the life of david gale,NURSE HUMPHRIES,f,"you can't go in there, ray! you'll never make it! wait for the firemen! stay calm, ray. we'll find him. claude! has anyone seen claude? is everyone here?"
1848,little nicky,REGIS,m,"i was deniro! recently, yes! so i run up behind this guy, and start bashing his brains in with this bat, and it made me feel happy! did you ever see the untouchables? i followed him all the way downtown, and when he gets out of the car, i reach under my seat and pull out an aluminum bat. so i followed him... so i was driving to work today, and some bozo in a cadillac cut me off..."
1865,logan's run,MAN,m,"no -- just there -- on the first level.  don't look for us. we'll see you. too little?  too little. okay, wait for me. cheeks? cheeks? right. too much, you think? well? how do you like it?"
1989,man on fire,SISTER ANNA,f,"[the bible says, ""be not overcome of evil, but overcome evil with good.""] [do you ever see the hand of god in what you do?] [no offense, but i'm sorry that your profession needs to exist.] [she's late, mr. creasy.]"
2054,metro,BAFFERT,m,"i'll take half of your action. what's the line? nah, it probably won't turn up anything. i'm just gonna talk to him. apartment 306. come on. just get in. we gotta go. where's the stereo? don't give up on her. you're getting to the age when you ought to be thinking about these things. no shit! he's good! speaking of which. i saw you talking to ronnie this morning. why can't you get it back together with her. you've gotta be out of your mind not to get with that one. this swat guy might be a good idea. he may be able to take a little pressure off you. i worry about you. i still gotta do it. wasting time is half my job. mind if we make a stop on the way? we busted frank antonucci on possession. he gave us a lead on that polk street jewelry heist. dinner's on you. floor seats. maybe we can get a throw phone in there. not that we know of. i don't know. no -- you can't do that. swat wants to go in. hello, roper. glad you could join us. this cousin of yours... what's his name? could i please have a little water? i've got to stop in there... mr. korda, do you know frank antonucci? where did you find an old recording like that? yeah... yeah... now i can hear it. may i come in? i would just like to ask you a couple of questions. it's lieutenant sam baffert from the san francisco police department."
2270,nick of time,CABBIE,?,"oh, yeah? the grave. somebody close? somebody close? aw, too bad. better in san diego? more opportunity there? what? 's okay. what do you think? oh, san diego? i've thought about moving to san diego.  it's hard to make a living in this town. these short hops.  can't make a dime on 'em. to lax, pasadena, then i can make a buck. these little hops cost me money. where'd you come from? business or pleasure? you just come in on amtrack? amtrack? where to, sir?"
2344,nixon,STUDENT 2,m,"come on, man -- vietnam ain't germany. it doesn't threaten us.  it's a civil war between the vietnamese. what you have to understand, mr. nixon, is that we are willing to die for what we believe in. ernie davis. syracuse. you're shittin' me."
2357,no country for old men,MOTHER,f,well i didn't see it. i didn't see my prednizone. three years ago i said them very words. no and good.
2429,panther,BOBBY SEALE,m,"no more police brutality! what do we want? sure, those boojie jokers don't do anything except print up a lotta paper saying ""black is beautiful."" what's up? huey!! man you gotta check this out... you're gonna love..."
2449,the patriot,CONTINENTAL SERGEANT,m,"we did. first virginia regulars under colonel hamilton. yes, sir."
2505,pleasantville,BOY,m,"""it was big 'n brown 'n kept goin' an' goin' as far you could see."" what is it? what's outside of pleasantville? and where's that? how'd you know how to put it out and all? how'd you know about the fire?"
2524,punch-drunk love,OPERATOR VOICE,?,it takes time to process -- i'm sorry. it takes that much time to process the order and make sure it's valid --
2657,serial mom,DET. BRADFORD,m,"goddamn you! that's trespassing! ""p"" as in... did you drive your car to the pta meeting yesterday, mrs. sutphin? contusions... fractures... rupture of numerous vital organs... sorry, ma'am.  we're investigating obscene phone calls and mail threats to a certain mrs. dottie hinkle."
2905,star trek: generations,DEMORA,f,"there's some buckling on the starboard nacelle.  we've also got a hull breach in the engineering section. emergency forcefields are in place and holding. deck 15, section 21-alpha. we're within range, sir. we're within visual range of the energy distortion, captain. the ships are bearing at 3-1-0 mark 2-1-5. distance: three light years."
2975,star trek: insurrection,PICARD'S COM VOICE,m,"very good, doctor. picard out. are they in any danger? and our people?"
2989,star trek: insurrection,SON'A OFFICER #2,m,"they must have been locked and secured after we were beamed here. all ship functions are off-line. sir, i am not showing any change in metaphasic flux levels... activating injector assembly."
3079,swingers,ANSWERING MACHINE,?,"you're money, baby. don't do it, mike. you should call your grandmother. are you calling her? you really should. life, after all, is really just a series of challenges... that's because it was a challenge. you has control over you're situation. it was hard, but you rose to it. moving here from new york was much more of an adjustment than this. ever since i've known you. you've been through worse. you have to put things in perspective. michael, this is grandma. i want to know if you got the part on that television program. i told the whole family and they're very excited to know if...  skipping message. end of final message."
3143,the rock,SANCHEZ,m,"name your vacation spot, goodspeed. the bureau'll pay for it. what do you have, a fucking water pistol?  get him back! don't let him do that. what is happening?  where's mason? spit it out. you're not wimping out on us, goodspeed. maybe.  not really. no."
3180,the body snatcher,MRS. MARSH,f,"it is a pity. it's not because of georgina -- because of dr. macfarlane's failure? good morning, mr. fettes. -- pain -- and shock.  she's brave enough, but i don't know about myself.  now that it seems so close, i wonder if i dare trust my child into any but god's hands. maybe he knows best. you have his promise, then? ask this one favor -- did he tell you about georgina? georgina told me how kind you were to her.  it gave me hope you might intercede for us with dr. macfarlane. i want you to help my little girl. she would if she could. i'm sorry, doctor.  georgina's a good child -- a brave child -- you saw how she was during the operation -- but if she can't move, she can't move. there's nothing i can say for one small child? but, doctor, surely in a case like this -- a child -- a little child who can never walk or run -- but can anything be done for her? three years. a carriage overturned.  my husband was killed and georgina was hurt. it comes at intervals.  they used to be months apart -- but they've been growing more frequent --  much more frequent. yes, doctor. nearly a year. no, doctor.  she seemed to get better, then about six months later she began to complain of pain in her back --"
3228,the thing,FUCHS,m,right.  why not? started with six.  there'd be four others left. 'bout eighty kilos southwest. gotta be from the norwegian camp.
3299,thirteen days,MCCONE,m,"it's transparent. the press'll be all over it. my specialists are in agreement: this morning's letter is not khruschev. last night's letter was.  the evidence supports only one conclusion: there has been a coup, and khruschev was replaced overnight. that may be what they want us to think. why else would they approach us in this way? it's deniable. the soviets have done nothing but lie to us. this could be more of the same."
3356,true believer,BALLISTICS EXPERT,?,"absolutely not. no more than seven percent. it most certainly is. no it is not, mr. dowd. absolutely. correct. true."
3466,white squall,COMMANDER,m,that is unfortunate.  we'll have to take him with us. stow away? but you invited is aboard. chicken is a fool's game captain.
3631,all the president's men,MCCORD,m,the c.i.a. ...central... intelligence... agency... government. recently retired. security consultant. james mccord.
3635,all the president's men,SWEET OLD LADY,f,i'm not miss abbott. the what to what? --i already get the post. i don't need another subscription.
3661,an american werewolf in paris,LEDUC,m,"my men think you died and floated away in the seine. if i wanted to, i could let them believe that.  but that would be illegal... i always wanted to do that. i saw it in a movie. i leave these open. maybe something comes back to you. merde... wait here. when i return you tell me about last night, huh? he was a good man. now his wife is a widow. that's not all...  marcel - officer boulard was following you. we know you were with her. you recognize her? i can't! at midnight tonight, he will kill again. it's crazy! i told you. these murders are not normal. i'm telling you. it's not drugs. it's something more. someth - now! i need two tactical assault squads at place denfert immediately. you can tell the commissioner it's a code red. what did she say? what've you got? what, you think everyone's as ignorant as you? you never heard the story of saint severin driving the werewolves from paris? you better follow that mcdermott kid. he's going to wind up like his uncle if he's not careful. two more nights in this lunar cycle. twelve thirty-six a.m. here. twelve forty a.m. here. there's two of them. at least. hmmph. at least now there's one person around here who doesn't think i'm crazy. well? here. merde."
3680,annie hall,ACTRESS,f,"you're like new york. you're an island. alvy, you are totally incapable of enjoying life. well, you only give me books with the word ""death"" in the title. what is so incredibly great about new york? it's a dying city! you-you read ""death in venice""."
3797,assassins,WOMAN,f,"electra -- jesus!  why didn't you tell me? god damnit, electra.  this is not a game.  this is business. the point is, they are paying for information.  real information.  not tooth paste brands.  not whether he wads of folds his toilet paper.  and no 16 hours of recorded phone sex. you are wasting everyone's time with this shit."
3861,the adventures of buckaroo banzai across the 8th dimension,JOHN O'CONNOR,m,but john whorfin said kill her. you look!  it's not here! not here!  no overthruster! i have a radio fix... what? a black ship?  where?  a black thermopod's been shot down ten miles back.
4010,being there,DUPONT,m,"i'm sorry to say that our time is running short, but before we close, i'd like to ask one final question. what sort of gardener, sir, would you be? well, mr. gardiner, from the sound of our audience, i'd say that your words are a most welcome respite from what we've been hearing from others... don't we need a leader capable of guiding us through the seasons? the bad as well as the good? well, let me rephrase the question; the president compared the economy of this country to a garden, and stated that after a period of decline a time of growth would naturally follow. do you go along with this belief? i know that, mr. gardiner. come now, mr. gardiner, before his speech at the financial institute the president consulted with you and benjamin rand, did he not? fine, then let's get started. the current state of our country is of vital interest to us all, and i would like to know if you agree with the president's view of the economy? yes... of course, you know, mr. gardiner, that i always prefer an open and frank conversation with my guests, i hope you don't object to that. ... well, your anonymity will be a thing of the past from now on. i always find it surprising, mr. gardiner, to find men like yourself, who are working so intimately with the president, yet manage to remain relatively unknown. i'd like to thank you for filling in on such short notice for the vice president. mr. gardiner, how very nice to have you with us this evening."
4050,the big lebowski,BLOND MAN,m,"you're not dealing with morons here. and we know which lebowski you are, lebowski. what do you think? wasn't this guy supposed to be a millionaire?"
4237,brazil,GIRL,f,"do you mind if i use your bathroom? yes, i know. it's the backlog, everybody complains. was it all right otherwise? you don't have to sing it. it's reply paid."
4249,brazil,MRS BUTTLE,f,"he hadn't done anything ... he was good ... what have you done with his body? what have you done with his body? my husband's dead, isn't he? mistake?"
4297,buffy the vampire slayer,AMILYN,f,"i don't know.  but the boy, he couldn't kill them. i look horrible. i had him in my grasp. my arm!  he took my fucking arm! i don't think this is gold."
4371,casino,TONY DOGS,m,"kill me, you fuck, kill me. charlie m. ch-charlie m! fuck you!"
4396,cellular,LENORE'S VOICE,f,"don't leave me here to die -- theo, please -- you can't let me die -- oh god -- oh no -- help me -- don't let me -- die. you mustn't hang up. thank god -- thank god i've got you."
4400,cellular,TRUCKER,?,you sure know how to take a lot of punishment. who the fuck you kidding?  send me money! the 405 is coming up. i thought so. what kind of treasury dept. business is this? government business? doesn't everybody? i already called for an ambulance.
4510,citizen kane,THE PRESIDENT,f,"you've made your point perfectly clear, mr. kane.  good day. i understand that you have political ambitions.  unfortunately, you seem incapable of allowing any other opinion but your own - i know the facts, mr. kane.  and i happen to have the incredible insolence to differ with you as to what they mean.  you're a man of great talents, mr. kane. i must refuse to allow you to continue in this vein, mr. kane. it is the unanimous opinion of my cabinent - in which i concur - that the proposed leases are in the best interests of the governement and the people.  you are not, i hope, suggesting that these interests are not indentical?"
4534,clerks,MAN,m,"it stings a little. thanks. i thought i was gonna have to go to the hospital. they oughta put some kind of warning on these cans, like they do with cigarettes. usually i just turn the can upside down."
4536,clerks,GIRL 1,f,"did he say ""making fuck?"" that doesn't sound metal. what did he say? no way! he only speaks russian? no way. he's your cousin? scumbag. what are you doing?"
4588,collateral,MAN,m,"...what do you want me to do, punch him out?  i have to work with him... ...i'm sorry, i don't see it that way... ...why is everything always about you..."
